{
  "ansatz": "powerlaw",
  "ansatz_parameters": {
    "p": 0.0006
  },
  "consistency_with_edges_2018": {
    "closest_evaluated_z": 17.0,
    "consistent_with_edges_at_2sigma": false,
    "edges_caveat": "EDGES 2018 absorption profile is reported but the cosmological interpretation remains controversial (foreground systematics challenged by SARAS3). Comparison is illustrative.",
    "edges_depth_mk": -500.0,
    "edges_depth_sigma_mk": 80.0,
    "edges_z_centre": 17.2,
    "gsc_predicted_depth_mk": -217.3272,
    "lcdm_baseline_depth_mk": -200.0,
    "predicted_minus_edges_mk": 282.6728,
    "z_score_vs_edges": 3.5334
  },
  "cosmology_inputs": {
    "Omega_b_h2": 0.02237,
    "Omega_m_h2": 0.143,
    "T_cmb_today_K": 2.7255
  },
  "determinism_note": "This file intentionally contains no timestamp; SHA-256 is a function only of the registered inputs.",
  "physics_status": "Parametric K_\u03c3 amplification shorthand for \u03c3-modified recombination, spin-temperature coupling, and X-ray heating. Full computation requires gsc/cosmic_dawn/ module (M202 milestone, ~2-3 months). The \u039bCDM baseline profile is a simplified Gaussian; M202 will replace it with proper spin-temperature evolution.",
  "prediction_id": "P2",
  "profile": [
    {
      "delta_T_b_diff_mK": -13.3096,
      "delta_T_b_gsc_mK": -173.4571,
      "delta_T_b_lcdm_mK": -160.1475,
      "frequency_MHz": 88.7754,
      "z": 15.0
    },
    {
      "delta_T_b_diff_mK": -16.067,
      "delta_T_b_gsc_mK": -205.2589,
      "delta_T_b_lcdm_mK": -189.1919,
      "frequency_MHz": 83.5533,
      "z": 16.0
    },
    {
      "delta_T_b_diff_mK": -17.3272,
      "delta_T_b_gsc_mK": -217.3272,
      "delta_T_b_lcdm_mK": -200.0,
      "frequency_MHz": 78.9114,
      "z": 17.0
    },
    {
      "delta_T_b_diff_mK": -16.6972,
      "delta_T_b_gsc_mK": -205.8891,
      "delta_T_b_lcdm_mK": -189.1919,
      "frequency_MHz": 74.7582,
      "z": 18.0
    },
    {
      "delta_T_b_diff_mK": -14.3798,
      "delta_T_b_gsc_mK": -174.5273,
      "delta_T_b_lcdm_mK": -160.1475,
      "frequency_MHz": 71.0203,
      "z": 19.0
    },
    {
      "delta_T_b_diff_mK": -11.0695,
      "delta_T_b_gsc_mK": -132.3756,
      "delta_T_b_lcdm_mK": -121.3061,
      "frequency_MHz": 67.6384,
      "z": 20.0
    },
    {
      "delta_T_b_diff_mK": -4.6866,
      "delta_T_b_gsc_mK": -54.5571,
      "delta_T_b_lcdm_mK": -49.8704,
      "frequency_MHz": 61.7568,
      "z": 22.0
    },
    {
      "delta_T_b_diff_mK": -0.5579,
      "delta_T_b_gsc_mK": -6.271,
      "delta_T_b_lcdm_mK": -5.7131,
      "frequency_MHz": 54.631,
      "z": 25.0
    }
  ],
  "registered_couplings": {
    "K_sigma_amplification": 50.0
  },
  "schema": "predictions_p2_pipeline_output_v1",
  "tier": "T2/T3",
  "title": "21cm Cosmic-Dawn signal in scale-covariant cosmology",
  "tool": "predictions_compute_P2",
  "tool_version": "v0.1-parametric-amplification"
}
